{"artifactKind":"CLI","artifactSha256":"f162b54de2adfc72d78adb1dbada2dedda111ae0a5e2f6e9500f4f909664c5d2","bindingEvidenceSha256":"fb3247ebfc2388227b524b9216649b425a9d6831ecd4d2108e16890f4cc3630b","bindingId":"rg-windows-x64-file-search","capabilityId":"file.search","catalogManifestSha256":"69d8308bf2d60b2ad6d0b093b66f0223949e1117bbde40e946bbab8b31ad9a46","catalogRevision":"shun-v030-catalog-r1","curatorSignature":"cCqkbLse6uWSqamWoFiPKgqPAta8ePbnV73YTItF/VQtioXn9PFzyoOCZLeFJqG1UZH4EjLAYgxUkM69YxxuAw==","dependencySha256":[],"entrypoint":"rg.exe","origin":"https://github.com/BurntSushi/ripgrep/releases/download/14.1.1/ripgrep-14.1.1-x86_64-pc-windows-msvc.zip","platform":"windows-x64","providerId":"ripgrep","scopedVerifierId":"shun-v030-curator","signerKeyId":"shun-v030-curator-root-1","version":"14.1.1"}
